{
  "$schema": "https://json-schema.org/draft/2020-12/schema",
  "$id": "https://synos.example/schema/bundle.schema.json",
  "title": "SynOS configuration bundle descriptor (bundle.json)",
  "description": "Written at the root of a configuration bundle by any generator (the web configurator, a script, a person). The build tool refuses bundles whose format it does not know or whose engine requirement it does not meet.",
  "type": "object",
  "required": [
    "format",
    "manifest"
  ],
  "additionalProperties": false,
  "properties": {
    "format": {
      "type": "integer",
      "minimum": 1,
      "description": "Bundle layout version; 1 is described in docs/BUNDLE.md"
    },
    "manifest": {
      "type": "string",
      "pattern": "^manifests/[a-z0-9][a-z0-9-]{0,63}\\.yml$",
      "description": "The manifest to build, relative to the bundle root"
    },
    "engine": {
      "type": "object",
      "additionalProperties": false,
      "properties": {
        "min": {
          "type": "string",
          "pattern": "^\\d+\\.\\d+\\.\\d+$",
          "description": "Oldest build engine (VERSION file) that understands this bundle"
        }
      }
    },
    "channel": {
      "type": "string",
      "enum": ["stable", "development"],
      "default": "stable",
      "description": "Which engine pipeline this bundle was generated for and must be built against: stable (the default, and assumed when this key is absent) builds against the newest released engine satisfying engine.min; development builds against the unreleased tip of the engine's main branch. Set by the front end that generated the bundle (docs/BUNDLE.md); a person building the bundle can still override it."
    },
    "generator": {
      "type": "object",
      "additionalProperties": false,
      "properties": {
        "name": {
          "type": "string",
          "maxLength": 80
        },
        "version": {
          "type": "string",
          "maxLength": 40
        },
        "url": {
          "type": "string",
          "maxLength": 200
        }
      }
    },
    "created": {
      "type": "string",
      "description": "ISO 8601 timestamp"
    },
    "name": {
      "type": "string",
      "pattern": "^[a-z0-9][a-z0-9-]{0,63}$",
      "description": "Short name of the configuration (the manifest file name without .yml)"
    },
    "description": {
      "type": "string",
      "maxLength": 500
    },
    "files": {
      "type": "array",
      "description": "Optional list of every file in the bundle except bundle.json itself. Plain names, or objects with the SHA-256 of the file's bytes so the engine can report what changed after generation.",
      "items": {
        "oneOf": [
          {
            "type": "string",
            "minLength": 1
          },
          {
            "type": "object",
            "required": [
              "path",
              "sha256"
            ],
            "additionalProperties": false,
            "properties": {
              "path": {
                "type": "string",
                "minLength": 1
              },
              "sha256": {
                "type": "string",
                "pattern": "^[0-9a-f]{64}$"
              }
            }
          }
        ]
      }
    },
    "signature": {
      "type": "object",
      "required": [
        "alg",
        "key_id",
        "value"
      ],
      "additionalProperties": false,
      "description": "Optional Ed25519 signature by the generator's service over the canonical JSON of format, name, manifest and the files list with digests (docs/BUNDLE.md). Proves origin and integrity, never that the content is safe; the engine validates every bundle the same way.",
      "properties": {
        "alg": {
          "const": "ed25519"
        },
        "key_id": {
          "type": "string",
          "minLength": 1,
          "maxLength": 64
        },
        "value": {
          "type": "string",
          "pattern": "^[0-9a-f]{128}$"
        }
      }
    }
  }
}
