{
  "format": 1,
  "name": "neo4j-server",
  "manifest": "manifests/neo4j-server.yml",
  "engine": {
    "min": "0.1.0"
  },
  "generator": {
    "name": "SynOS bundle catalog",
    "version": "0.1.0"
  },
  "created": "2026-09-23T00:00:00Z",
  "description": "Neo4j Graph Database — ubuntu noble amd64, profile neo4j-server",
  "files": [
    "manifests/neo4j-server.yml",
    "profiles/neo4j-server.yml"
  ]
}
