{
  "format": 1,
  "name": "yocto-builder-docs",
  "manifest": "manifests/yocto-builder-docs.yml",
  "engine": {
    "min": "0.1.0"
  },
  "generator": {
    "name": "SynOS bundle catalog",
    "version": "0.1.0"
  },
  "created": "2026-09-22T00:00:00Z",
  "description": "Yocto Build Machine, full \u2014 ubuntu noble amd64, profile yocto-builder-docs",
  "files": [
    "manifests/yocto-builder-docs.yml",
    "profiles/yocto-builder-docs.yml"
  ]
}
