{
  "format": 1,
  "name": "ai-workstation",
  "manifest": "manifests/ai-workstation.yml",
  "engine": {
    "min": "0.1.0"
  },
  "generator": {
    "name": "SynOS bundle catalog",
    "version": "0.1.0"
  },
  "created": "2026-09-22T00:00:00Z",
  "description": "AI Workstation \u2014 ubuntu noble amd64, profile ai-workstation",
  "files": [
    "manifests/ai-workstation.yml"
  ]
}
