{
  "format": 1,
  "name": "edge-proxy",
  "manifest": "manifests/edge-proxy.yml",
  "engine": {
    "min": "0.2.0"
  },
  "generator": {
    "name": "SynOS bundle catalog",
    "version": "0.1.0"
  },
  "created": "2026-09-22T00:00:00Z",
  "description": "Edge Proxy and Load Balancer \u2014 ubuntu noble amd64, profile edge-proxy",
  "files": [
    "manifests/edge-proxy.yml",
    "profiles/edge-proxy.yml"
  ]
}
