{
  "format": 1,
  "name": "personal-cloud",
  "manifest": "manifests/personal-cloud.yml",
  "engine": {
    "min": "0.1.0"
  },
  "generator": {
    "name": "SynOS bundle catalog",
    "version": "0.1.0"
  },
  "created": "2026-09-22T00:00:00Z",
  "description": "Personal Cloud \u2014 ubuntu noble amd64, profile personal-cloud",
  "files": [
    "manifests/personal-cloud.yml",
    "profiles/personal-cloud.yml"
  ]
}
