{
  "format": 1,
  "name": "cluster-coordination",
  "manifest": "manifests/cluster-coordination.yml",
  "engine": {
    "min": "0.1.0"
  },
  "generator": {
    "name": "SynOS bundle catalog",
    "version": "0.1.0"
  },
  "created": "2026-09-22T00:00:00Z",
  "description": "Cluster Coordination \u2014 ubuntu noble amd64, profile cluster-coordination",
  "files": [
    "manifests/cluster-coordination.yml",
    "profiles/cluster-coordination.yml"
  ]
}
