{
  "format": 1,
  "name": "vpn-server",
  "manifest": "manifests/vpn-server.yml",
  "engine": {
    "min": "0.3.0"
  },
  "generator": {
    "name": "SynOS bundle catalog",
    "version": "0.1.0"
  },
  "created": "2026-09-22T00:00:00Z",
  "description": "VPN Server — ubuntu noble amd64, profile vpn-server",
  "files": [
    "manifests/vpn-server.yml",
    "profiles/vpn-server.yml"
  ]
}
