{
  "format": 1,
  "name": "stream-processing",
  "manifest": "manifests/stream-processing.yml",
  "engine": {
    "min": "0.1.0"
  },
  "generator": {
    "name": "SynOS bundle catalog",
    "version": "0.1.0"
  },
  "created": "2026-09-22T00:00:00Z",
  "description": "Stream Processing \u2014 ubuntu noble amd64, profile stream-processing",
  "files": [
    "manifests/stream-processing.yml",
    "profiles/stream-processing.yml"
  ]
}
