{
  "format": 1,
  "name": "media-server",
  "manifest": "manifests/media-server.yml",
  "engine": {
    "min": "0.1.0"
  },
  "generator": {
    "name": "SynOS bundle catalog",
    "version": "0.1.0"
  },
  "created": "2026-09-22T00:00:00Z",
  "description": "Media Server \u2014 ubuntu noble amd64, profile media-server",
  "files": [
    "manifests/media-server.yml",
    "profiles/media-server.yml"
  ]
}
