{
  "format": 1,
  "name": "container-registry",
  "manifest": "manifests/container-registry.yml",
  "engine": {
    "min": "0.1.0"
  },
  "generator": {
    "name": "SynOS bundle catalog",
    "version": "0.1.0"
  },
  "created": "2026-09-22T00:00:00Z",
  "description": "Container Registry \u2014 ubuntu noble amd64, profile container-registry",
  "files": [
    "manifests/container-registry.yml",
    "profiles/container-registry.yml"
  ]
}
