{
  "format": 1,
  "name": "devops-platform",
  "manifest": "manifests/devops-platform.yml",
  "engine": {
    "min": "0.2.0"
  },
  "generator": {
    "name": "SynOS bundle catalog",
    "version": "0.1.0"
  },
  "created": "2026-09-22T00:00:00Z",
  "description": "DevOps Platform \u2014 ubuntu noble amd64, profile devops-platform",
  "files": [
    "manifests/devops-platform.yml",
    "profiles/devops-platform.yml"
  ]
}
