{
  "format": 1,
  "name": "web-server-apache",
  "manifest": "manifests/web-server-apache.yml",
  "engine": {
    "min": "0.1.0"
  },
  "generator": {
    "name": "SynOS bundle catalog",
    "version": "0.1.0"
  },
  "created": "2026-09-22T00:00:00Z",
  "description": "Web Server (Apache) \u2014 ubuntu noble amd64, profile web-server-apache",
  "files": [
    "manifests/web-server-apache.yml",
    "profiles/web-server-apache.yml"
  ]
}
