{
  "format": 1,
  "name": "distributed-compute",
  "manifest": "manifests/distributed-compute.yml",
  "engine": {
    "min": "0.1.0"
  },
  "generator": {
    "name": "SynOS bundle catalog",
    "version": "0.1.0"
  },
  "created": "2026-09-22T00:00:00Z",
  "description": "Distributed Compute \u2014 ubuntu noble amd64, profile distributed-compute",
  "files": [
    "manifests/distributed-compute.yml",
    "profiles/distributed-compute.yml"
  ]
}
